{
  "conflict_override_justification": null,
  "errors": [],
  "files": [
    {
      "changed": true,
      "conflicts": [],
      "legacy_keys": [],
      "mappings": [],
      "normalizations": [
        "phase_normalized_to_string",
        "status_normalized"
      ],
      "path": "tasks/PERF-001/meta.yml",
      "schema_after": "1",
      "schema_before": "0"
    },
    {
      "changed": true,
      "conflicts": [],
      "legacy_keys": [],
      "mappings": [],
      "normalizations": [
        "phase_normalized_to_string",
        "status_normalized"
      ],
      "path": "tasks/PERF-002/meta.yml",
      "schema_after": "1",
      "schema_before": "0"
    },
    {
      "changed": true,
      "conflicts": [],
      "legacy_keys": [],
      "mappings": [],
      "normalizations": [
        "phase_normalized_to_string",
        "status_normalized"
      ],
      "path": "tasks/PERF-003/meta.yml",
      "schema_after": "1",
      "schema_before": "0"
    },
    {
      "changed": true,
      "conflicts": [],
      "legacy_keys": [],
      "mappings": [],
      "normalizations": [
        "evidence_normalized_to_list",
        "phase_normalized_to_string",
        "status_normalized",
        "verification_normalized_to_list"
      ],
      "path": "tasks/PERF-004/meta.yml",
      "schema_after": "1",
      "schema_before": "0"
    },
    {
      "changed": true,
      "conflicts": [],
      "legacy_keys": [],
      "mappings": [],
      "normalizations": [
        "phase_normalized_to_string",
        "status_normalized"
      ],
      "path": "tasks/PERF-005/meta.yml",
      "schema_after": "1",
      "schema_before": "0"
    },
    {
      "changed": true,
      "conflicts": [],
      "legacy_keys": [],
      "mappings": [],
      "normalizations": [
        "phase_normalized_to_string",
        "status_normalized"
      ],
      "path": "tasks/PERF-005A/meta.yml",
      "schema_after": "1",
      "schema_before": "0"
    },
    {
      "changed": true,
      "conflicts": [],
      "legacy_keys": [],
      "mappings": [],
      "normalizations": [
        "phase_normalized_to_string",
        "status_normalized"
      ],
      "path": "tasks/PERF-006/meta.yml",
      "schema_after": "1",
      "schema_before": "0"
    },
    {
      "changed": true,
      "conflicts": [],
      "legacy_keys": [],
      "mappings": [],
      "normalizations": [
        "phase_normalized_to_string",
        "status_normalized"
      ],
      "path": "tasks/R-000/meta.yml",
      "schema_after": "1",
      "schema_before": "0"
    },
    {
      "changed": true,
      "conflicts": [],
      "legacy_keys": [
        "affected_files",
        "dependencies",
        "id",
        "implementation_plan_path",
        "verification_command"
      ],
      "mappings": [
        {
          "action": "mapped",
          "new_key": "touches",
          "old_key": "affected_files"
        },
        {
          "action": "mapped",
          "new_key": "depends_on",
          "old_key": "dependencies"
        },
        {
          "action": "mapped",
          "new_key": "task_id",
          "old_key": "id"
        },
        {
          "action": "mapped",
          "new_key": "implementation_plan",
          "old_key": "implementation_plan_path"
        },
        {
          "action": "mapped",
          "new_key": "verification",
          "old_key": "verification_command"
        }
      ],
      "normalizations": [
        "evidence_normalized_to_list",
        "phase_normalized_to_string",
        "status_normalized",
        "verification_normalized_to_list"
      ],
      "path": "tasks/R-001/meta.yml",
      "schema_after": "1",
      "schema_before": "0"
    },
    {
      "changed": true,
      "conflicts": [],
      "legacy_keys": [
        "affected_files",
        "dependencies",
        "id",
        "implementation_plan_path",
        "verification_command"
      ],
      "mappings": [
        {
          "action": "mapped",
          "new_key": "touches",
          "old_key": "affected_files"
        },
        {
          "action": "mapped",
          "new_key": "depends_on",
          "old_key": "dependencies"
        },
        {
          "action": "mapped",
          "new_key": "task_id",
          "old_key": "id"
        },
        {
          "action": "mapped",
          "new_key": "implementation_plan",
          "old_key": "implementation_plan_path"
        },
        {
          "action": "mapped",
          "new_key": "verification",
          "old_key": "verification_command"
        }
      ],
      "normalizations": [
        "evidence_normalized_to_list",
        "phase_normalized_to_string",
        "status_normalized",
        "verification_normalized_to_list"
      ],
      "path": "tasks/R-002/meta.yml",
      "schema_after": "1",
      "schema_before": "0"
    },
    {
      "changed": true,
      "conflicts": [],
      "legacy_keys": [
        "affected_files",
        "dependencies",
        "id",
        "implementation_plan_path",
        "verification_command"
      ],
      "mappings": [
        {
          "action": "mapped",
          "new_key": "touches",
          "old_key": "affected_files"
        },
        {
          "action": "mapped",
          "new_key": "depends_on",
          "old_key": "dependencies"
        },
        {
          "action": "mapped",
          "new_key": "task_id",
          "old_key": "id"
        },
        {
          "action": "mapped",
          "new_key": "implementation_plan",
          "old_key": "implementation_plan_path"
        },
        {
          "action": "mapped",
          "new_key": "verification",
          "old_key": "verification_command"
        }
      ],
      "normalizations": [
        "evidence_normalized_to_list",
        "phase_normalized_to_string",
        "status_normalized",
        "verification_normalized_to_list"
      ],
      "path": "tasks/R-003/meta.yml",
      "schema_after": "1",
      "schema_before": "0"
    },
    {
      "changed": true,
      "conflicts": [],
      "legacy_keys": [
        "affected_files",
        "dependencies",
        "id",
        "implementation_plan_path",
        "verification_command"
      ],
      "mappings": [
        {
          "action": "mapped",
          "new_key": "touches",
          "old_key": "affected_files"
        },
        {
          "action": "mapped",
          "new_key": "depends_on",
          "old_key": "dependencies"
        },
        {
          "action": "mapped",
          "new_key": "task_id",
          "old_key": "id"
        },
        {
          "action": "mapped",
          "new_key": "implementation_plan",
          "old_key": "implementation_plan_path"
        },
        {
          "action": "mapped",
          "new_key": "verification",
          "old_key": "verification_command"
        }
      ],
      "normalizations": [
        "evidence_normalized_to_list",
        "phase_normalized_to_string",
        "status_normalized",
        "verification_normalized_to_list"
      ],
      "path": "tasks/R-004/meta.yml",
      "schema_after": "1",
      "schema_before": "0"
    },
    {
      "changed": true,
      "conflicts": [],
      "legacy_keys": [
        "affected_files",
        "dependencies",
        "id",
        "implementation_plan_path",
        "verification_command"
      ],
      "mappings": [
        {
          "action": "mapped",
          "new_key": "touches",
          "old_key": "affected_files"
        },
        {
          "action": "mapped",
          "new_key": "depends_on",
          "old_key": "dependencies"
        },
        {
          "action": "mapped",
          "new_key": "task_id",
          "old_key": "id"
        },
        {
          "action": "mapped",
          "new_key": "implementation_plan",
          "old_key": "implementation_plan_path"
        },
        {
          "action": "mapped",
          "new_key": "verification",
          "old_key": "verification_command"
        }
      ],
      "normalizations": [
        "evidence_normalized_to_list",
        "phase_normalized_to_string",
        "status_normalized",
        "verification_normalized_to_list"
      ],
      "path": "tasks/R-005/meta.yml",
      "schema_after": "1",
      "schema_before": "0"
    },
    {
      "changed": true,
      "conflicts": [],
      "legacy_keys": [
        "affected_files",
        "dependencies",
        "id",
        "implementation_plan_path",
        "verification_command"
      ],
      "mappings": [
        {
          "action": "mapped",
          "new_key": "touches",
          "old_key": "affected_files"
        },
        {
          "action": "mapped",
          "new_key": "depends_on",
          "old_key": "dependencies"
        },
        {
          "action": "mapped",
          "new_key": "task_id",
          "old_key": "id"
        },
        {
          "action": "mapped",
          "new_key": "implementation_plan",
          "old_key": "implementation_plan_path"
        },
        {
          "action": "mapped",
          "new_key": "verification",
          "old_key": "verification_command"
        }
      ],
      "normalizations": [
        "evidence_normalized_to_list",
        "phase_normalized_to_string",
        "status_normalized",
        "verification_normalized_to_list"
      ],
      "path": "tasks/R-006/meta.yml",
      "schema_after": "1",
      "schema_before": "0"
    },
    {
      "changed": true,
      "conflicts": [],
      "legacy_keys": [
        "affected_files",
        "dependencies",
        "id",
        "implementation_plan_path",
        "verification_command"
      ],
      "mappings": [
        {
          "action": "mapped",
          "new_key": "touches",
          "old_key": "affected_files"
        },
        {
          "action": "mapped",
          "new_key": "depends_on",
          "old_key": "dependencies"
        },
        {
          "action": "mapped",